{
    "$schema": "area.schema.json",
    "prop_bundle": "FIELD_PROPS_EXTERIOR_ASPERTIA_CITY_GYM",
    "texture_set": "MAP_TEXTURE_SET_SHARED_DANSA01A_225",
    "srt_animation": 0,
    "pattern_animation": 0,
    "exterior": true,
    "lights": 143,
    "edge_color_table": 0,
    "actor_material_color": 1
}
