{
    "$schema": "area.schema.json",
    "prop_bundle": "FIELD_PROPS_EXTERIOR_SHARED_PC_01_7",
    "texture_set": "MAP_TEXTURE_SET_SHARED_DANSA01A_37",
    "srt_animation": 38,
    "pattern_animation": 0,
    "exterior": true,
    "lights": 142,
    "edge_color_table": 0,
    "actor_material_color": 1
}
