{
    "$schema": "area.schema.json",
    "prop_bundle": "FIELD_PROPS_EXTERIOR_LOSTLORN_FOREST",
    "texture_set": "MAP_TEXTURE_SET_SHARED_DANSA01A_175",
    "srt_animation": 0,
    "pattern_animation": 0,
    "exterior": true,
    "lights": 142,
    "edge_color_table": 0,
    "actor_material_color": 1
}
